{
  "schema_version": "uaa_morning_reconciliation_artifact.v1",
  "task_ref": "UAA-P1-061",
  "reconciliation_id": "reconciliation:2026-06-21-uaa-p1-064-ready-next-promotion",
  "created_at_utc": "2026-06-21T00:00:00Z",
  "source_loop_ref": "loop:uaa-p1-064-ready-next-promotion",
  "operator_readiness_taxonomy_ref": "docs/roadmap/OPERATOR_READINESS_STATUS_TAXONOMY.md",
  "recommendation_log_ref": "docs/backlog/codex_recommendation_log.md",
  "safe_summary": "UAA-P1-064 was promoted as the Ready Next read-only local model inventory and CLI inspection milestone; implementation has not started.",
  "completed_recommendations": [
    {
      "recommendation_ref": "recommendation:uaa-p1-064-ready-next-scope",
      "status": "completed",
      "source_milestone_ref": "UAA-P1-064",
      "safe_summary": "Documented the read-only Python Agent Core local model inventory and CLI inspection milestone with explicit non-goals and verification.",
      "reason_code": "COMPLETED_WITH_EVIDENCE",
      "evidence_refs": [
        "doc:docs/model_management/UAA_P1_064_LOCAL_MODEL_INVENTORY_READ_ONLY.md",
        "board:docs/kanban/current_board.md",
        "roadmap:docs/roadmap/OPERATOR_RUNTIME_EXCELLENCE_ROADMAP.md",
        "doc:docs/roadmap/PRODUCT_RELEASE_TRUTH_PACKET.md"
      ],
      "next_action_ref": "prompt-ref:uaa-p1-064-conveyor-restart"
    }
  ],
  "deferred_recommendations": [
    {
      "recommendation_ref": "recommendation:uaa-p1-064-implementation",
      "status": "deferred",
      "source_milestone_ref": "UAA-P1-064",
      "safe_summary": "Implementation of read-only local model inventory and CLI inspection is deferred until the conveyor starts from the promoted milestone scope.",
      "reason_code": "READY_NEXT_NOT_STARTED",
      "evidence_refs": [
        "doc:docs/model_management/UAA_P1_064_LOCAL_MODEL_INVENTORY_READ_ONLY.md",
        "board:docs/kanban/current_board.md"
      ],
      "next_action_ref": "prompt-ref:uaa-p1-064-conveyor-restart"
    }
  ],
  "rejected_recommendations": [
    {
      "recommendation_ref": "recommendation:uaa-p1-064-react-authority",
      "status": "rejected",
      "source_milestone_ref": "UAA-P1-064",
      "safe_summary": "React-owned local model truth remains rejected; any later UI must render Python-core owned state.",
      "reason_code": "CONTROL_CENTER_NOT_AUTHORITY",
      "evidence_refs": [
        "doc:docs/model_management/UAA_P1_064_LOCAL_MODEL_INVENTORY_READ_ONLY.md",
        "doc:docs/control_center/OPERATOR_SHELL_GAP_MAP.md"
      ],
      "next_action_ref": "none:rejected"
    }
  ],
  "blocked_recommendations": [
    {
      "recommendation_ref": "recommendation:uaa-p1-064-runtime-authority",
      "status": "blocked",
      "source_milestone_ref": "UAA-P1-064",
      "safe_summary": "Lifecycle control, switching, downloads, route authority, Control Center activation, and runtime adapters remain blocked without later exact scoped milestones.",
      "reason_code": "MISSING_SCOPED_AUTHORITY",
      "evidence_refs": [
        "doc:docs/model_management/UAA_P1_064_LOCAL_MODEL_INVENTORY_READ_ONLY.md",
        "board:docs/kanban/current_board.md",
        "doc:docs/roadmap/PRODUCT_RELEASE_TRUTH_PACKET.md"
      ],
      "next_action_ref": "blocker:local-model-runtime-authority-scope"
    }
  ],
  "next_prompt_ref": "prompt-ref:uaa-p1-064-conveyor-restart",
  "reconciliation_safety": {
    "raw_prompt_included": false,
    "raw_response_included": false,
    "raw_provider_payload_included": false,
    "raw_path_included": false,
    "raw_log_included": false,
    "username_included": false,
    "hostname_included": false,
    "serial_included": false,
    "environment_dump_included": false,
    "credential_material_included": false,
    "private_content_included": false
  }
}
